{
  "message_type": "tool.execution_result",
  "protocol_version": "0.1.0",
  "request_id": "req-0001",
  "task_id": "task-0001",
  "span_id": "span-0001",
  "device_id": "device-0001",
  "tool": "phone.current_app",
  "parameters": {},
  "execution_status": "SUCCEEDED",
  "before_state": null,
  "after_state": null,
  "duration": 12,
  "error": null,
  "recoverable": false,
  "timestamp": "2026-08-30T10:00:01Z",
  "attempt": 1,
  "idempotency_key": "idem-0001",
  "parameter_digest": "sha256:44136fa355b3678a1146ad16f7e8649e94fb4fc21fe77e8310c060f61caaff8a",
  "permission_decision_id": null,
  "verification": {
    "status": "NOT_APPLICABLE",
    "observed_state_ids": [],
    "evaluator": "none",
    "explanation": "read-only query"
  },
  "artifacts": [],
  "redactions": []
}
